<?xml version="1.0" encoding="UTF-8"?>
<xs:schema xmlns:xs="http://www.w3.org/2001/XMLSchema">
    <xs:element name="empleados">
        <xs:complexType>
            <xs:sequence>
                <xs:element name="ficha" maxOccurs="unbounded">
                    <xs:complexType>
                        <xs:sequence>
                            <xs:element name="nombre" maxOccurs="unbounded">
                                <xs:complexType>
                                    <xs:simpleContent>
                                        <xs:extension base="xs:string">
                                            <xs:attribute name="telefono" type="xs:string" use="required"/>
                                        </xs:extension>
                                    </xs:simpleContent>
                                </xs:complexType>
                            </xs:element>
                            <xs:element name="edad" type="xs:integer"/>
                        </xs:sequence>
                        <xs:attribute name="numero" type="xs:integer" use="required"/>
                    </xs:complexType>

                </xs:element>
            </xs:sequence>
        </xs:complexType>
    </xs:element>
</xs:schema>